{
    "$schema": "/Users/yi/Documents/Repo.nosync/latex_ps_gen/schema.json",
    "courseTitle": "Honors Analysis II",
    "author": "Kavya Tumkur",
    "psNumberingScheme": "roman",
    "questionNumberingScheme": {
        "scheme": "description"
    },
    "packages": [
        "amsmath",
        "amssymb"
    ]
}